{
  "schema_version": 1,
  "id": "approval-fixture-004",
  "content_item_id": "visual-maison-feed",
  "decision": "approved",
  "binary_fingerprint": "cccccccccccccccccccccccccccccccccccccccccccccccccccccccccccccccc",
  "copy_fingerprint": "dddddddddddddddddddddddddddddddddddddddddddddddddddddddddddddddd",
  "reviewer_id": "operator-fixture",
  "note": "Manual flagship approval fixture.",
  "created_at": "2026-07-19T00:06:00.000Z"
}
